<?xml version="1.0" encoding="UTF-8"?>
<!--
  USMC issuance schema, version 1.1.

  A USLM-aligned profile for service issuances, extending the House USLM model
  downward to Marine Corps and DoD documents. v1.0 covered MARADMINs (naval
  messages). v1.1 generalizes to other document types encountered in the corpus:
    - DoD memoranda / Directive-Type Memoranda: named sections (Purpose,
      Applicability, Policy ...), attachments, a glossary, a dated signer.
    - Marine Corps Orders: From/To/Subj/Ref/Encl headers, enclosures, chapters.
  Backward compatible: every v1.0 document still validates.

  This schema defines DOCUMENT STRUCTURE only. The authority relationships
  between issuances live in the authority ontology (schema/authority-ontology.ttl)
  and the per-document authority graph (data/*.authority.jsonld).

  Design goals it enforces:
    1. Every provision is addressable      -> @identifier is required everywhere.
    2. Verification is on the face of data  -> @status (VERIFIED|UNVERIFIED) is
                                               required on the issuance and on
                                               every provision. Nothing is
                                               encoded without declaring whether
                                               it is confirmed against the source.
    3. Multi-level numbering is first-class -> <paragraph> nests to any depth and
                                               <num> carries an explicit @style.
    4. Structure beyond numbered paragraphs -> <num> is optional (named sections),
                                               and @level labels the structural
                                               unit (section/attachment/enclosure/
                                               chapter/appendix/part).
-->
<xs:schema xmlns:xs="http://www.w3.org/2001/XMLSchema"
           xmlns="https://policy.usmc.mil/ns/uslm/1.0"
           targetNamespace="https://policy.usmc.mil/ns/uslm/1.0"
           elementFormDefault="qualified">

  <!-- Confirmed against the source issuance text, or not yet. -->
  <xs:simpleType name="VerificationStatus">
    <xs:restriction base="xs:string">
      <xs:enumeration value="VERIFIED"/>
      <xs:enumeration value="UNVERIFIED"/>
    </xs:restriction>
  </xs:simpleType>

  <!-- Enumeration style of a provision designator. -->
  <xs:simpleType name="EnumStyle">
    <xs:restriction base="xs:string">
      <xs:enumeration value="arabic"/>       <!-- 1  2  3   -->
      <xs:enumeration value="alpha-lower"/>  <!-- a  b  c    -->
      <xs:enumeration value="alpha-upper"/>  <!-- A  B  C    -->
      <xs:enumeration value="paren-arabic"/> <!-- (1) (2)    -->
      <xs:enumeration value="paren-alpha"/>  <!-- (a) (b)    -->
      <xs:enumeration value="paren-alpha-upper"/> <!-- (A) (B)  U.S. Code -->
      <xs:enumeration value="paren-roman-lower"/> <!-- (i) (ii) U.S. Code -->
      <xs:enumeration value="paren-roman-upper"/> <!-- (I) (II) U.S. Code -->
      <xs:enumeration value="compound"/>     <!-- 8.b.(2)    -->
    </xs:restriction>
  </xs:simpleType>

  <!-- Structural unit a provision represents (default: paragraph). -->
  <xs:simpleType name="StructuralLevel">
    <xs:restriction base="xs:string">
      <xs:enumeration value="section"/>
      <xs:enumeration value="attachment"/>
      <xs:enumeration value="enclosure"/>
      <xs:enumeration value="chapter"/>
      <xs:enumeration value="appendix"/>
      <xs:enumeration value="part"/>
      <xs:enumeration value="paragraph"/>
    </xs:restriction>
  </xs:simpleType>

  <!-- A stable, path-style identifier, e.g. /us/dod/don/usmc/maradmin/2023/051/p8 -->
  <xs:simpleType name="Identifier">
    <xs:restriction base="xs:string">
      <xs:pattern value="/[A-Za-z0-9._/()-]+"/>
    </xs:restriction>
  </xs:simpleType>

  <xs:element name="issuance">
    <xs:complexType>
      <xs:sequence>
        <xs:element name="meta" type="Meta"/>
        <xs:element name="paragraph" type="Paragraph" maxOccurs="unbounded"/>
      </xs:sequence>
      <xs:attribute name="identifier" type="Identifier" use="required"/>
      <!-- e.g. MARADMIN, MCO, SECNAVINST, DODI -->
      <xs:attribute name="issuanceType" type="xs:string" use="required"/>
      <xs:attribute name="status" type="VerificationStatus" use="required"/>
    </xs:complexType>
  </xs:element>

  <xs:complexType name="Meta">
    <xs:sequence>
      <xs:element name="originator" type="xs:string"/>
      <!-- dtg for naval messages; date for memos/orders. At least one applies. -->
      <xs:element name="dtg" type="xs:string" minOccurs="0"/>
      <xs:element name="date" type="xs:string" minOccurs="0"/>
      <!-- Normalized ISO 8601 date (YYYY-MM-DD) for sorting and filtering. -->
      <xs:element name="isoDate" type="xs:string" minOccurs="0"/>
      <xs:element name="signer" type="xs:string" minOccurs="0"/>
      <xs:element name="subject" type="xs:string"/>
      <!-- Upward authority links; resolved in the authority graph. -->
      <xs:element name="derivesFrom" type="AuthorityRef"
                  minOccurs="0" maxOccurs="unbounded"/>
    </xs:sequence>
  </xs:complexType>

  <xs:complexType name="AuthorityRef">
    <xs:attribute name="href" type="Identifier" use="required"/>
  </xs:complexType>

  <!-- A provision. Recursive: a paragraph may contain sub-paragraphs.
       num is optional so named sections (Purpose, Applicability, ...) and
       containers (attachments, enclosures, chapters) need not be numbered. -->
  <xs:complexType name="Paragraph">
    <xs:sequence>
      <xs:element name="num" type="Num" minOccurs="0"/>
      <xs:element name="heading" type="xs:string" minOccurs="0"/>
      <xs:element name="content" type="Content" minOccurs="0"/>
      <xs:element name="paragraph" type="Paragraph"
                  minOccurs="0" maxOccurs="unbounded"/>
    </xs:sequence>
    <xs:attribute name="identifier" type="Identifier" use="required"/>
    <xs:attribute name="status" type="VerificationStatus" use="required"/>
    <xs:attribute name="level" type="StructuralLevel"/>
    <xs:attribute name="derivesFrom" type="Identifier"/>
  </xs:complexType>

  <xs:complexType name="Num">
    <xs:simpleContent>
      <xs:extension base="xs:string">
        <xs:attribute name="style" type="EnumStyle"/>
      </xs:extension>
    </xs:simpleContent>
  </xs:complexType>

  <xs:complexType name="Content">
    <xs:sequence>
      <xs:element name="p" type="xs:string" maxOccurs="unbounded"/>
    </xs:sequence>
  </xs:complexType>

</xs:schema>
